{
  "individuals": [
    {"id": "P001", "surname": "DEMOZZI", "givenNames": "Giacomo", "birthYear": 1764, "birthPlace": "Sardagna", "deathYear": null, "spouse": "Anesi Margherita", "emigration": {"destination": null, "year": null}, "notes": "soprannome: Rizòti→Gèchi"},
    {"id": "P003", "surname": "DEMOZZI", "givenNames": "Dominicus", "birthYear": 1795, "birthPlace": null, "deathYear": null, "spouse": null, "emigration": {"destination": null, "year": null}, "notes": null},
    {"id": "P007", "surname": "DEMOZZI", "givenNames": "Domenico", "birthYear": 1809, "birthPlace": null, "deathYear": null, "spouse": "Elisabetta Margoni", "emigration": {"destination": null, "year": null}, "notes": null},
    {"id": "P008", "surname": "DEMOZZI", "givenNames": "Giacomo", "birthYear": 1813, "birthPlace": null, "deathYear": null, "spouse": "Domenica Degasperi", "emigration": {"destination": null, "year": null}, "notes": null},
    {"id": "P009", "surname": "DEMOZZI", "givenNames": "Francesco", "birthYear": 1814, "birthPlace": null, "deathYear": null, "spouse": "Domenica Casot", "emigration": {"destination": null, "year": null}, "notes": null},
    {"id": "P016", "surname": "DEMOZZI", "givenNames": "Gaudenzo", "birthYear": 1837, "birthPlace": null, "deathYear": null, "spouse": "Orsola Ravagni", "emigration": {"destination": null, "year": null}, "notes": null},
    {"id": "P017", "surname": "DEMOZZI", "givenNames": "Pietro Luigi", "birthYear": 1854, "birthPlace": null, "deathYear": null, "spouse": null, "emigration": {"destination": null, "year": null}, "notes": null},
    {"id": "P018", "surname": "DEMOZZI", "givenNames": "Isidoro", "birthYear": 1849, "birthPlace": null, "deathYear": null, "spouse": "Irene Ferrari", "emigration": {"destination": null, "year": null}, "notes": null},
    {"id": "P020", "surname": "DEMOZZI", "givenNames": "Gaudenzo", "birthYear": 1837, "birthPlace": null, "deathYear": null, "spouse": "Orsola Ravagni", "emigration": {"destination": null, "year": null}, "notes": null},
    {"id": "P022", "surname": "DEMOZZI", "givenNames": "Gioachino", "birthYear": 1864, "birthPlace": null, "deathYear": null, "spouse": "Catterina Pisetta", "emigration": {"destination": "USA", "year": null}, "notes": "soprannome: Gèchi"},
    {"id": "P029", "surname": "DEMOZZI", "givenNames": "Francesco", "birthYear": 1848, "birthPlace": null, "deathYear": null, "spouse": "Elina Casagrande", "emigration": {"destination": null, "year": null}, "notes": null},
    {"id": "P100", "surname": "DEMOZZI", "givenNames": "Giovanni", "birthYear": 1800, "birthPlace": null, "deathYear": null, "spouse": "Domenica Giacomelli", "emigration": {"destination": null, "year": null}, "notes": "soprannome: Cagliarei/Scorsori"},
    {"id": "P101", "surname": "DEMOZZI", "givenNames": "Luigi", "birthYear": 1836, "birthPlace": null, "deathYear": null, "spouse": "Catterina Baldessari", "emigration": {"destination": null, "year": null}, "notes": null},
    {"id": "P106", "surname": "DEMOZZI", "givenNames": "Fortunato Giosuè", "birthYear": 1844, "birthPlace": null, "deathYear": null, "spouse": "Rosa Forti", "emigration": {"destination": null, "year": null}, "notes": "soprannome: Scorsor"},
    {"id": "P108", "surname": "DEMOZZI", "givenNames": "Giovanbattista Pietro", "birthYear": 1830, "birthPlace": null, "deathYear": null, "spouse": "Teresa Demozzi", "emigration": {"destination": null, "year": null}, "notes": null},
    {"id": "P109", "surname": "DEMOZZI", "givenNames": "Giovanbattista Nicolò", "birthYear": 1834, "birthPlace": null, "deathYear": null, "spouse": null, "emigration": {"destination": null, "year": null}, "notes": null},
    {"id": "P110", "surname": "DEMOZZI", "givenNames": "Fortunato", "birthYear": 1864, "birthPlace": null, "deathYear": null, "spouse": "Luigia Degasperi", "emigration": {"destination": null, "year": null}, "notes": null},
    {"id": "P115", "surname": "DEMOZZI", "givenNames": "Fortunato Luigi", "birthYear": 1883, "birthPlace": null, "deathYear": null, "spouse": null, "emigration": {"destination": null, "year": null}, "notes": null},
    {"id": "P119", "surname": "DEMOZZI", "givenNames": "Domenico", "birthYear": 1874, "birthPlace": null, "deathYear": null, "spouse": null, "emigration": {"destination": "ARG", "year": null}, "notes": null},
    {"id": "P120", "surname": "DEMOZZI", "givenNames": "Fortunato Francesco", "birthYear": 1877, "birthPlace": null, "deathYear": null, "spouse": null, "emigration": {"destination": null, "year": null}, "notes": null},
    {"id": "P122", "surname": "DEMOZZI", "givenNames": "Albina", "birthYear": 1891, "birthPlace": null, "deathYear": null, "spouse": null, "emigration": {"destination": null, "year": null}, "notes": null},
    {"id": "P123", "surname": "DEMOZZI", "givenNames": "Fiore Rosa", "birthYear": 1887, "birthPlace": null, "deathYear": null, "spouse": "Domenico Depedri", "emigration": {"destination": null, "year": null}, "notes": null},
    {"id": "P124", "surname": "DEMOZZI", "givenNames": "Maria Giuditta", "birthYear": 1885, "birthPlace": null, "deathYear": null, "spouse": "Pietro Degasperi", "emigration": {"destination": null, "year": null}, "notes": null},
    {"id": "P125", "surname": "DEMOZZI", "givenNames": "Evaristo", "birthYear": 1864, "birthPlace": null, "deathYear": null, "spouse": "Rosalia Degasperi", "emigration": {"destination": null, "year": null}, "notes": "soprannome: Varisti"},
    {"id": "P200", "surname": "DEGASPERI", "givenNames": "Giuseppe", "birthYear": 1795, "birthPlace": null, "deathYear": null, "spouse": "Anna Demozzi dei Rizòti", "emigration": {"destination": null, "year": null}, "notes": "soprannome: Peraci"},
    {"id": "P201", "surname": "DEGASPERI", "givenNames": "Pietro", "birthYear": 1820, "birthPlace": null, "deathYear": null, "spouse": "Maddalena Caveden", "emigration": {"destination": null, "year": null}, "notes": "Sardagna→Vela 1842"},
    {"id": "P202", "surname": "DEGASPERI", "givenNames": "Giuseppe Giorgio", "birthYear": 1822, "birthPlace": null, "deathYear": null, "spouse": "Teresa Cadonna", "emigration": {"destination": null, "year": null}, "notes": "batt. 26.1.1822"},
    {"id": "P203", "surname": "DEGASPERI", "givenNames": "Pietro Enrico", "birthYear": 1855, "birthPlace": null, "deathYear": null, "spouse": "Oliva Fadanelli", "emigration": {"destination": null, "year": null}, "notes": "soprannome: Peracia"},
    {"id": "P204", "surname": "DEGASPERI", "givenNames": "Giacomo", "birthYear": 1825, "birthPlace": null, "deathYear": null, "spouse": "Anna Degasperi", "emigration": {"destination": null, "year": null}, "notes": null},
    {"id": "P206", "surname": "DEGASPERI", "givenNames": "Albina", "birthYear": 1860, "birthPlace": null, "deathYear": null, "spouse": "Giovanni Berloffa", "emigration": {"destination": null, "year": null}, "notes": null},
    {"id": "P207", "surname": "DEGASPERI", "givenNames": "Luigia", "birthYear": 1862, "birthPlace": null, "deathYear": null, "spouse": "Demozzi Fortunato", "emigration": {"destination": null, "year": null}, "notes": null},
    {"id": "P208", "surname": "DEGASPERI", "givenNames": "Luigi", "birthYear": 1836, "birthPlace": null, "deathYear": null, "spouse": null, "emigration": {"destination": null, "year": null}, "notes": "n. Sardagna"},
    {"id": "P209", "surname": "DEGASPERI", "givenNames": "Giuditta", "birthYear": 1838, "birthPlace": null, "deathYear": null, "spouse": null, "emigration": {"destination": null, "year": null}, "notes": "n. Sardagna"},
    {"id": "P300", "surname": "DEGASPERI", "givenNames": "Gasparo Domenico", "birthYear": 1822, "birthPlace": null, "deathYear": null, "spouse": null, "emigration": {"destination": null, "year": null}, "notes": "batt. 2.10.1822"},
    {"id": "P301", "surname": "DEGASPERI", "givenNames": "Giorgio Angelo", "birthYear": 1823, "birthPlace": null, "deathYear": null, "spouse": null, "emigration": {"destination": null, "year": null}, "notes": "batt. 19.6.1823"},
    {"id": "P302", "surname": "DEGASPERI", "givenNames": "Maria Teresa", "birthYear": 1818, "birthPlace": null, "deathYear": null, "spouse": null, "emigration": {"destination": null, "year": null}, "notes": "batt. 18.9.1818"},
    {"id": "P303", "surname": "DEGASPERI", "givenNames": "Giuseppe Giorgio", "birthYear": 1822, "birthPlace": null, "deathYear": null, "spouse": null, "emigration": {"destination": null, "year": null}, "notes": "batt. 26.1.1822"},
    {"id": "P304", "surname": "DEGASPERI", "givenNames": "Francesco Antonio", "birthYear": 1815, "birthPlace": null, "deathYear": null, "spouse": null, "emigration": {"destination": null, "year": null}, "notes": "batt. 12.8.1815"},
    {"id": "P305", "surname": "BERLOFFA", "givenNames": "Giuseppe Antonio", "birthYear": 1820, "birthPlace": null, "deathYear": null, "spouse": null, "emigration": {"destination": null, "year": null}, "notes": "batt. 17.1.1820"},
    {"id": "P306", "surname": "CADONA", "givenNames": "Domenica Rosa", "birthYear": 1824, "birthPlace": null, "deathYear": null, "spouse": null, "emigration": {"destination": null, "year": null}, "notes": "batt. 2.3.1824"},
    {"id": "P307", "surname": "MOZZI", "givenNames": "Giuseppe Antonio", "birthYear": 1815, "birthPlace": null, "deathYear": null, "spouse": null, "emigration": {"destination": null, "year": null}, "notes": "batt. 27.11.1815"},
    {"id": "P308", "surname": "CAVEDEN", "givenNames": "Teresa Margherita", "birthYear": 1820, "birthPlace": null, "deathYear": null, "spouse": null, "emigration": {"destination": null, "year": null}, "notes": "batt. 5.11.1820"},
    {"id": "P309", "surname": "ECCEL", "givenNames": "Antonio Battista", "birthYear": 1822, "birthPlace": null, "deathYear": null, "spouse": null, "emigration": {"destination": null, "year": null}, "notes": "batt. 5.3.1822"},